<?xml version="1.0" encoding="UTF-8"?>
<!--使用dtd约束-->
<!--<!DOCTYPE root PUBLIC "yl-dynamic-sql.xsd" "https://yiueil.github.io/static-repo/static/dtd/yl-dynamic-sql.dtd">-->

<!--是应用xsd约束-->
<root cache="true"
      xmlns="http://www.yiueil.cc"
      xmlns:xsi="http://www.w3.org/2001/XMLSchema-instance"
      xsi:schemaLocation="http://www.yiueil.cc https://yiueil.github.io/static-repo/static/xsd/yl-dynamic-sql.xsd">
    <config id="exampleConfig">
        <sql><![CDATA[
            select * from table where 1 = 1 and id in (:ids)
        ]]></sql>
        <params>
            <param name="ids"/>
        </params>
        <filters>
            <filter name="guid" left="" right=""><![CDATA[
                and guid = :guid
            ]]></filter>
        </filters>
        <endSql><![CDATA[
            order by id desc
        ]]></endSql>
    </config>
</root>
